{"api_version":"1","cancel_requested":true,"lease_id":"11111111-1111-4111-8111-111111111111","lease_status":"issued","next_attempt_at":"2026-08-28T18:05:30Z","request_id":"req_reconcile_01","retry_count":2,"state":"applying","stop_acceptance":{"accepted":true,"cleanup_pending":true,"lease_id":"20000000-0000-4000-8000-000000000003","operation_id":"20000000-0000-4000-8000-000000000006","session_id":"20000000-0000-4000-8000-000000000001"}}